{
  "$schema": "https://json-schema.org/draft/2020-12/schema",
  "$id": "https://github.com/dmytro-yemelianov/dry/spec/dry-profile-v1.schema.json",
  "title": "Dry machine/material profile v1",
  "description": "Schema for a Dry machine/material/process profile (see docs/11-profiles-and-reports.md). Describes the canonical field names that Dry writes. The engine ALSO accepts documented deserialization aliases (bounds, speed_range, max_flow, max_volumetric_flow, min_temp, min_nozzle_temp) and, like serde, ignores unknown keys; this schema validates the canonical form.",
  "type": "object",
  "required": ["version"],
  "properties": {
    "version": {
      "type": "integer",
      "enum": [1],
      "description": "Profile schema version. v1 is the initial Dry profile schema."
    },
    "name": { "type": "string", "description": "Human-readable profile name, for reports." },
    "firmware": {
      "type": "object",
      "properties": {
        "flavor": {
          "type": "string",
          "description": "Firmware output target: marlin, klipper, duet, rs274, grbl, robot-krl (or krl), siemens (or sinumerik), haas, heidenhain (or tnc), rapid, irbcam (or irbcam-json), irbcam-csv, apt (or apt-cl)"
        }
      }
    },
    "machine": {
      "type": "object",
      "properties": {
        "build_volume": {
          "type": "array",
          "minItems": 3,
          "maxItems": 3,
          "items": {
            "type": "array",
            "minItems": 2,
            "maxItems": 2,
            "items": { "type": "number" }
          },
          "description": "[[x_lo,x_hi],[y_lo,y_hi],[z_lo,z_hi]] in mm (alias: bounds)."
        },
        "feedrate_range": {
          "type": "array",
          "minItems": 2,
          "maxItems": 2,
          "items": { "type": "number" },
          "description": "[min,max] mm/min for extruding moves (alias: speed_range)."
        },
        "kinematics": {
          "type": "object",
          "description": "Deterministic kinematic limits consumed by the `balanced` optimisation pipeline (see docs/11). Optional and additive; firmware-agnostic (no pressure-advance / input-shaper model).",
          "properties": {
            "max_acceleration_mm_s2": {
              "type": "number",
              "exclusiveMinimum": 0,
              "description": "Max toolhead acceleration in mm/s^2; drives the arc centripetal speed limit v=sqrt(a*r)."
            },
            "max_junction_velocity_mm_s": {
              "type": "number",
              "exclusiveMinimum": 0,
              "description": "Max junction (square-corner) velocity in mm/s; caps the per-junction feedrate."
            }
          }
        },
        "five_axis": {
          "description": "The rotary model that maps a toolframe orientation onto two rotary words: the string \"ab\"/\"ac\"/\"bc\", or an object naming the same type plus mechanical offsets. Absent means the reference B/C machine.",
          "oneOf": [
            { "type": "string", "enum": ["ab", "ac", "bc"] },
            {
              "type": "object",
              "required": ["type"],
              "properties": {
                "type": { "type": "string", "enum": ["ab", "ac", "bc"] },
                "pivot_offset": {
                  "type": "array",
                  "minItems": 3,
                  "maxItems": 3,
                  "items": { "type": "number" }
                },
                "rotary_offset": {
                  "type": "array",
                  "minItems": 2,
                  "maxItems": 2,
                  "items": { "type": "number" }
                }
              }
            }
          ]
        },
        "rotary": {
          "type": "object",
          "description": "What the rotary axes of the `five_axis` machine can actually do. Optional and additive; absent leaves the rotary-travel, rotary-feed and orientation-reachability rules unevaluated.",
          "properties": {
            "travel_deg": {
              "type": "object",
              "description": "Per-axis rotary travel [min,max] in degrees, keyed by axis letter. An axis with no range is unconstrained.",
              "properties": {
                "a": { "$ref": "#/$defs/Range" },
                "b": { "$ref": "#/$defs/Range" },
                "c": { "$ref": "#/$defs/Range" }
              }
            },
            "max_feed_deg_min": {
              "type": "number",
              "exclusiveMinimum": 0,
              "description": "Maximum rate for any rotary axis, in deg/min."
            },
            "envelope_mm": {
              "type": "array",
              "minItems": 3,
              "maxItems": 3,
              "items": { "$ref": "#/$defs/Range" },
              "description": "[[x_lo,x_hi],[y_lo,y_hi],[z_lo,z_hi]] in mm, in MACHINE coordinates (after the rotation is applied). Distinct from build_volume, which is in programmed workpiece coordinates."
            }
          }
        },
        "cnc": {
          "type": "object",
          "description": "CNC work-coordinate/tool/spindle/coolant frame, flowed verbatim into EmitParams::cnc_frame. Read only by the RS-274 renderer: absent, or under any other firmware flavor, emitted g-code is unchanged. Every key is optional.",
          "properties": {
            "wcs": {
              "type": "integer",
              "minimum": 54,
              "maximum": 59,
              "description": "Work coordinate system 54..=59, emitted as G54..G59. Absent defaults to G54."
            },
            "tool": {
              "type": "integer",
              "minimum": 0,
              "description": "Tool number for the `T<n> M6` tool change. Absent omits the tool change."
            },
            "spindle_rpm": {
              "type": "number",
              "exclusiveMinimum": 0,
              "description": "Spindle speed in RPM for `S<rpm> M3`. Absent omits the spindle start (and the `M5` stop)."
            },
            "coolant": {
              "type": "boolean",
              "description": "Flood coolant. `true` emits `M8` in the preamble and `M9` in the postamble; `false` and absent both emit neither."
            }
          }
        }
      }
    },
    "material": {
      "type": "object",
      "properties": {
        "filament_diameter": { "type": "number", "exclusiveMinimum": 0 },
        "max_volumetric_flow_mm3_s": {
          "type": "number",
          "exclusiveMinimum": 0,
          "description": "mm^3/s (aliases: max_flow, max_volumetric_flow)."
        },
        "min_nozzle_temperature_c": {
          "type": "number",
          "exclusiveMinimum": 0,
          "description": "deg C (aliases: min_temp, min_nozzle_temp)."
        }
      }
    },
    "process": {
      "type": "object",
      "properties": {
        "line_width": { "type": "number", "exclusiveMinimum": 0 },
        "layer_height": { "type": "number", "exclusiveMinimum": 0 },
        "monotonic_z": { "type": "boolean" },
        "max_retraction_distance": { "type": "number", "exclusiveMinimum": 0 },
        "max_retraction_speed": { "type": "number", "exclusiveMinimum": 0 },
        "max_travel_without_retraction": { "type": "number", "exclusiveMinimum": 0 },
        "first_layer_height_range": {
          "type": "array",
          "minItems": 2,
          "maxItems": 2,
          "items": { "type": "number", "minimum": 0 }
        },
        "first_layer_speed_range": {
          "type": "array",
          "minItems": 2,
          "maxItems": 2,
          "items": { "type": "number", "minimum": 0 }
        },
        "travel_must_be_dark": { "type": "boolean" }
      }
    },
    "start_gcode": { "$ref": "#/$defs/GcodeProcedure" },
    "end_gcode": { "$ref": "#/$defs/GcodeProcedure" }
  },
  "$defs": {
    "Range": {
      "type": "array",
      "minItems": 2,
      "maxItems": 2,
      "items": { "type": "number" }
    },
    "GcodeProcedure": {
      "description": "A start/end procedure as a single multi-line string or an array of command lines.",
      "oneOf": [
        { "type": "string" },
        { "type": "array", "items": { "type": "string" } }
      ]
    }
  }
}
