{
  "version": 1,
  "name": "cura-BLV MGN Cube 300",
  "firmware": {
    "flavor": "marlin"
  },
  "machine": {
    "build_volume": [
      [
        0.0,
        300.0
      ],
      [
        0.0,
        300.0
      ],
      [
        0.0,
        465.0
      ]
    ],
    "feedrate_range": [
      6000.0,
      7200.0
    ]
  },
  "material": {
    "filament_diameter": 1.75,
    "min_nozzle_temperature_c": 190.0
  },
  "process": {
    "line_width": 0.4,
    "layer_height": 0.2,
    "monotonic_z": false
  },
  "start_gcode": "G21 ;metric values\nG90 ;absolute positioning\nM82 ;set extruder to absolute mode\nM107 ;start with the fan off\nG92 E0 ;zero the extruded length\nM104 S170 T0; start preheat hotend_0\nM140 S60 ; start preheating the bed\nM190 S60 ; heat to Cura Bed setting\nG28\nG12 P1 S2 T3\nG34\nG29\nG1 X0 Y0 Z1 F9000\nM109 S210 T0\nG1 X100 Y0 Z0.1 E30 F500 ;intro line\nG92 E0 ;zero the extruded length again\nM117 Printing...\n",
  "end_gcode": "G91 ;relative positioning\nG1 Z5 F500; move nozzle relative to position\nG90 ;absolute positioning\nG1 X0 Y300\nG12 P1 T3\nM104 S0\nM140 S0\nG92 E0\nM84\nM109 S50\nM81\n"
}