{
  "version": 1,
  "name": "cura-Uni 250",
  "firmware": {
    "flavor": "marlin"
  },
  "machine": {
    "build_volume": [
      [
        0.0,
        270.0
      ],
      [
        0.0,
        220.0
      ],
      [
        0.0,
        250.0
      ]
    ],
    "feedrate_range": [
      4800.0,
      7200.0
    ]
  },
  "material": {
    "filament_diameter": 1.75,
    "min_nozzle_temperature_c": 190.0
  },
  "process": {
    "line_width": 0.4,
    "layer_height": 0.2,
    "monotonic_z": false
  },
  "start_gcode": "G21\nG90\nM82\nM220 S100\nM221 S100\nG28\nM190 S60\nM109 S210\nG1 F600 Z15\nG92 E0\nG1 F300 E10\nM117 Printing...\n;\n",
  "end_gcode": "G91\nG1 E-1 F600\nG1 Z+1 E-3 X-20 Y-20 F4800\nM104 S0\nM106 S0\nM140 S0\nM220 S100\nM221 S100\nG28\nG90\nM84\n;\n"
}