{
  "version": 1,
  "name": "cura-Blocks RD50 - Duplication Mode",
  "firmware": {
    "flavor": "marlin"
  },
  "machine": {
    "build_volume": [
      [
        0.0,
        500.0
      ],
      [
        0.0,
        500.0
      ],
      [
        0.0,
        500.0
      ]
    ],
    "feedrate_range": [
      3600.0,
      9000.0
    ]
  },
  "material": {
    "filament_diameter": 1.75,
    "min_nozzle_temperature_c": 190.0
  },
  "process": {
    "line_width": 0.4,
    "layer_height": 0.2,
    "monotonic_z": false
  },
  "start_gcode": ";INITIALIZE DUPLICATION MODE\nM605 S1      ; AUTO-PARK MODE\nT0           ; Set tool 0\nG28          ; Home all axes\nG28 X\nM605 S2      ; Set duplication mode\n; PREHEAT\nM140 S60   ; Set Heat Bed temperature\nM104 S210 ; Set Extruder temperature\nM190 S60   ; Wait for Heat Bed temperature\nM109 S210 ; Wait for Extruder temperature\n;SET DUPLICATION MODE\nM605 S2 X622 ; Set duplication mode and nozzle offset\nG28 X\nG1 X-60 F3000\nM605 S3 X622 ; Set mirror mode and nozzle offset\nM82\nG92 E0       ; Reset Extruder\nG1 F400\nG1 E40 F400  ; Prime\nG12          ; Clean Nozzle\nM605 S2 X250\nG28 X\nG92 E0 ; Reset Extruder\nG1 X0 F3000\n",
  "end_gcode": "M104 S0 ;extruder heater off\nM140 S0 ;heated bed heater off (if you have it)\nG91 ;relative positioning\nG1 E-1 F300 ;retract the filament a bit before lifting the nozzle, to release some of the pressure\nG1 Z+1 E-1 X-20 Y-20 F6000 ;move Z up a bit and retract filament even more\nM605 S1      ; AUTO-PARK MODE\nG28 X Y ;move X/Y to min endstops, so the head is out of the way\nM84 ;steppers off\nG90 ;absolute positioning\n"
}