{
  "version": 1,
  "name": "cura-Koonovo KN5 Idex",
  "firmware": {
    "flavor": "marlin"
  },
  "machine": {
    "build_volume": [
      [
        0.0,
        420.0
      ],
      [
        0.0,
        420.0
      ],
      [
        0.0,
        400.0
      ]
    ],
    "feedrate_range": [
      3000.0,
      7200.0
    ]
  },
  "material": {
    "filament_diameter": 1.75,
    "min_nozzle_temperature_c": 190.0
  },
  "process": {
    "line_width": 0.4,
    "layer_height": 0.2,
    "monotonic_z": false
  },
  "start_gcode": "G21 ;metric values\nG90 ;absolute positioning\nM82 ;set extruder to absolute mode\nM107 ;start with the fan off\nG28 ;Move to min endstops\nG1 Z15.0 F9000 ;move the platform down 15mm\nM117 Printing...",
  "end_gcode": "M104 T0 S0 ;1st extruder heater off\nM104 T1 S0 ;2nd extruder heater off\nM140 S0 ;heated bed heater off (if you have it)\nG91 ;relative positioning\nG1 E-1 F300  ;retract the filament a bit before lifting the nozzle, to release some of the pressure\nG1 Z+0.5 E-5 X-20 Y-20 F9000 ;move Z up a bit and retract filament even more\nG28 X0 Y0 ;move X/Y to min endstops, so the head is out of the way\nM84 ;steppers off\nG90 ;absolute positioning"
}