{
  "version": 1,
  "name": "cura-Anycubic 4Max",
  "firmware": {
    "flavor": "marlin"
  },
  "machine": {
    "build_volume": [
      [
        0.0,
        220.0
      ],
      [
        0.0,
        220.0
      ],
      [
        0.0,
        300.0
      ]
    ],
    "feedrate_range": [
      2400.0,
      3600.0
    ]
  },
  "material": {
    "filament_diameter": 2.85,
    "min_nozzle_temperature_c": 190.0
  },
  "process": {
    "line_width": 0.4,
    "layer_height": 0.2,
    "monotonic_z": false
  },
  "start_gcode": "G21 ;metric values\nG90 ;absolute positioning\nM82 ;set extruder to absolute mode\nM107 ;start with the fan off\nG28 X0 Y0 ;move X/Y to min endstops\nG28 Z0 ;move Z to min endstops\nG1 Z15.0 F3600 ;move the platform down 15mm\nG92 E0 ;zero the extruded length\nG1 F200 E3 ;extrude 3mm of feed stock\nG92 E0 ;zero the extruded length again\nG1 F3600\nM117 Printing...\nG5",
  "end_gcode": "M104 S0 ; turn off extruder\nM140 S0 ; turn off bed\nM84 ; disable motors\nM107\nG91 ;relative positioning\nG1 E-1 F300 ;retract the filament a bit before lifting the nozzle, to release some of the pressure\nG1 Z+0.5 E-5 ;X-20 Y-20 F3600 ;move Z up a bit and retract filament even more\nG28 X0 ;Y0 ;move X/Y to min endstops, so the head is out of the way\nG1 Y180 F2000\nM84 ;steppers off\nG90\nM300 P300 S4000"
}