{
  "version": 1,
  "name": "cura-Cubicon Single",
  "firmware": {
    "flavor": "marlin"
  },
  "machine": {
    "build_volume": [
      [
        0.0,
        240.0
      ],
      [
        0.0,
        190.0
      ],
      [
        0.0,
        200.0
      ]
    ],
    "feedrate_range": [
      3600.0,
      7200.0
    ]
  },
  "material": {
    "filament_diameter": 2.85,
    "min_nozzle_temperature_c": 190.0
  },
  "process": {
    "line_width": 0.4,
    "layer_height": 0.2,
    "monotonic_z": false
  },
  "start_gcode": "M911 3DP-110F\nM201 X400 Y400\nM202 X400 Y400\nG28 ; Home\nG1 Z15.0 F6000 ;move the platform down 15mm\n;Prime the extruder\nG92 E0\nG1 F200 E3\nG92 E0",
  "end_gcode": "M104 S0\nM140 S0\nM904\nM117 Print completed! \nM84"
}