{
  "version": 1,
  "name": "cura-Anet ET4 X",
  "firmware": {
    "flavor": "marlin"
  },
  "machine": {
    "build_volume": [
      [
        0.0,
        220.0
      ],
      [
        0.0,
        220.0
      ],
      [
        0.0,
        250.0
      ]
    ],
    "feedrate_range": [
      3000.0,
      9000.0
    ]
  },
  "material": {
    "filament_diameter": 1.75,
    "min_nozzle_temperature_c": 190.0
  },
  "process": {
    "line_width": 0.4,
    "layer_height": 0.2,
    "monotonic_z": false
  },
  "start_gcode": "G28 ;Home\nG1 Z15.0 F2000 ;Move the platform",
  "end_gcode": "M104 S0\nM140 S0\nG92 E0\nG1 E-10 F2000\nG28 X0 Y0\nM84"
}