{
  "version": 1,
  "name": "cura-Alfawise U30",
  "firmware": {
    "flavor": "marlin"
  },
  "machine": {
    "build_volume": [
      [
        0.0,
        220.0
      ],
      [
        0.0,
        220.0
      ],
      [
        0.0,
        250.0
      ]
    ],
    "feedrate_range": [
      2400.0,
      7200.0
    ]
  },
  "material": {
    "filament_diameter": 1.75,
    "min_nozzle_temperature_c": 190.0
  },
  "process": {
    "line_width": 0.4,
    "layer_height": 0.2,
    "monotonic_z": false
  },
  "start_gcode": "; -- START GCODE --\nG21        ;metric values\nG90        ;absolute positioning\nM82        ;set extruder to absolute mode\nM107       ;start with the fan off\nG28 X0 Y0  ;move X/Y to min endstops\nG28 Z0     ;move Z to min endstops\nG1 Z1 F1000             ;move up slightly\nG1 Y60.0 Z0 E9.0 F1000.0;intro line\nG1 Y100.0 E21.5 F1000.0 ;continue line\nG92 E0                  ;zero the extruded length again\nG1 F80\n;Put printing message on LCD screen\nM117 Printing...\n; -- end of START GCODE --",
  "end_gcode": "; -- END GCODE --\nM104 S0                     ;extruder heater off\nM140 S0                     ;heated bed heater off (if you have it)\nG91                                    ;relative positioning\nG1 E-1 F300                            ;retract the filament a bit before lifting the nozzle, to release some of the pressure\nG1 Z+0.5 E-5 X-20 Y-20 F80 ;move Z up a bit and retract filament even more\nG28 X0 Y0                              ;move X/Y to min endstops, so the head is out of the way\nM84                         ;steppers off\nG90                         ;absolute positioning\nM107       ;turn the fan off; -- end of END GCODE --"
}