{
  "version": 1,
  "name": "cura-Snapmaker 2 A150",
  "firmware": {
    "flavor": "marlin"
  },
  "machine": {
    "build_volume": [
      [
        0.0,
        160.0
      ],
      [
        0.0,
        160.0
      ],
      [
        0.0,
        145.0
      ]
    ],
    "feedrate_range": [
      3600.0,
      7200.0
    ]
  },
  "material": {
    "filament_diameter": 1.75,
    "min_nozzle_temperature_c": 190.0
  },
  "process": {
    "line_width": 0.4,
    "layer_height": 0.2,
    "monotonic_z": false
  },
  "start_gcode": "M104 S205 ;Set Hotend Temperature\nM140 S60 ;Set Bed Temperature\nG28 ;home\nG90 ;absolute positioning\nG1 X-10 Y-10 F3000 ;Move to corner \nG1 Z0 F1800 ;Go to zero offset\nM109 S205 ;Wait for Hotend Temperature\nM190 S60 ;Wait for Bed Temperature\nG92 E0 ;Zero set extruder position\nG1 E20 F200 ;Feed filament to clear nozzle\nG92 E0 ;Zero set extruder position",
  "end_gcode": "M104 S0 ;Extruder heater off\nM140 S0 ;Heated bed heater off\nG90 ;absolute positioning\nG92 E0 ;Retract the filament\nG1 E-1 F300 ;retract the filament a bit before lifting the nozzle, to release some of the pressure\nG1 Z145 E-1 F3000 ;move Z up a bit and retract filament even more\nG1 X0 F3000 ;move X to min endstops, so the head is out of the way\nG1 Y160 F3000 ;so the head is out of the way and Plate is moved forward"
}