{
  "version": 1,
  "name": "cura-BQ Prusa i3 Hephestos",
  "firmware": {
    "flavor": "marlin"
  },
  "machine": {
    "build_volume": [
      [
        0.0,
        215.0
      ],
      [
        0.0,
        210.0
      ],
      [
        0.0,
        180.0
      ]
    ],
    "feedrate_range": [
      2400.0,
      7200.0
    ]
  },
  "material": {
    "filament_diameter": 2.85,
    "min_nozzle_temperature_c": 190.0
  },
  "process": {
    "line_width": 0.4,
    "layer_height": 0.2,
    "monotonic_z": false
  },
  "start_gcode": "; -- START GCODE --\nG21                     ;set units to millimetres\nG90                     ;set to absolute positioning\nM106 S0                 ;set fan speed to zero (turned off)\nG28 X0 Y0               ;move to the X/Y origin (Home)\nG28 Z0                  ;move to the Z origin (Home)\nG1 Z15.0 F1200          ;move Z to position 15.0 mm\nG92 E0                  ;zero the extruded length\nG1 E20 F200             ;extrude 20mm of feed stock\nG92 E0                  ;zero the extruded length again\nG1 F7200                ;set feedrate to 120 mm/s\n; -- end of START GCODE --",
  "end_gcode": "; -- END GCODE --\nM104 S0                 ;set extruder temperature to zero (turned off)\nG91                     ;set to relative positioning\nG1 E-20 F300            ;retract the filament a bit to release some of the pressure\nG1 Z10                  ;move extruder up 10 mm\nG90                     ;set to absolute positioning\nG1 X0 Y180 F1200        ;expose the platform\nM84                     ;turn off steppers\n; -- end of END GCODE --"
}