{
  "version": 1,
  "name": "cura-Geeetech A10Pro",
  "firmware": {
    "flavor": "marlin"
  },
  "machine": {
    "build_volume": [
      [
        0.0,
        220.0
      ],
      [
        0.0,
        220.0
      ],
      [
        0.0,
        260.0
      ]
    ],
    "feedrate_range": [
      3600.0,
      7200.0
    ]
  },
  "material": {
    "filament_diameter": 2.85,
    "min_nozzle_temperature_c": 190.0
  },
  "process": {
    "line_width": 0.4,
    "layer_height": 0.2,
    "monotonic_z": false
  },
  "start_gcode": ";Geeetech A10Pro Custom Start G-code\nM104 S200 ; Set Hotend Temperature\nM190 S60 ; Wait for Bed Temperature\nM109 S200 ; Wait for Hotend Temperature\nG92 E0 ; Reset Extruder\nG28 ; Home all axes\nM107 P0 ;Off Main Fan\nM107 P1 ;Off Aux Fan\nM2012 P8 S1 F100 ; ON Light\nG1 Z5.0 F3000 ;Move Z Axis up little to prevent scratching of Heat Bed\nG1 X0.1 Y20 Z0.8 F5000 ; Move to start position\nG1 X0.1 Y200.0 Z1.2 F1500 E30 ; Draw the first line\nG92 E0 ; Reset Extruder\nG1 X0.4 Y200.0 Z1.2 F3000 ; Move to side a little\nG1 X0.4 Y20 Z1.2 F1500 E25 ; Draw the second line\nG92 E0 ; Reset Extruder\nG1 Z2.0 F3000 ; Move Z Axis up little to prevent scratching of Heat Bed\nG1 X5 Y20 Z0.4 F3000.0 ; Scrape off nozzle residue",
  "end_gcode": "G91 ;Switch to relative positioning\nG1 E-2.5 F2700 ;Retract filament\nG1 E-1.5 Z0.2 F2400 ;Retract and raise Z\nG1 X5 Y5 F3000 ;Move away\nG1 Z10 ;lift print head\nG90 ;Switch to absolute positioning\nG28 X Y ;homing XY\nM106 S0 ;off Fan\nM104 S0 ;Cooldown hotend\nM140 S0 ;Cooldown bed\nM84 X Y E ;Disable steppers"
}