{
  "version": 1,
  "name": "cura-Galaxy 600",
  "firmware": {
    "flavor": "marlin"
  },
  "machine": {
    "build_volume": [
      [
        0.0,
        500.0
      ],
      [
        0.0,
        500.0
      ],
      [
        0.0,
        600.0
      ]
    ],
    "feedrate_range": [
      3600.0,
      9000.0
    ]
  },
  "material": {
    "filament_diameter": 2.85,
    "min_nozzle_temperature_c": 190.0
  },
  "process": {
    "line_width": 0.4,
    "layer_height": 0.2,
    "monotonic_z": false
  },
  "start_gcode": "G21 ; set units to millimeters\nG90 ; use absolute positioning\nM82 ; absolute extrusion mode\nG28 ; home all without mesh bed level\nM420 S1\nG92 E0.0 ; reset extruder distance position\nG1 Z0.25\nG1 X60.0 E9.0 F1000.0 ; intro line\nG1 X100.0 E21.5 F1000.0 ; intro line\nG92 E0.0 ; reset extruder distance position",
  "end_gcode": "M104 T0 S0                     ;extruder heater off\nM104 T1 S0                     ;extruder heater off\nM140 S0                     ;heated bed heater off\nG91\nG1 Z1 F420                                        ;relative positioning\nG1 E-1 F300                            ;retract the filament a bit before lifting the nozzle, to release some of the pressure\nG1 Z+1 E-1 F300 ;move Z up a bit and retract filament even more\nG90                         ;absolute positioning\nG1 X0 Y300 F6000                              ;move the head out of the way\nM84                         ;steppers off"
}