{
  "version": 1,
  "name": "cura-Ultimaker 2+ Connect",
  "firmware": {
    "flavor": "marlin"
  },
  "machine": {
    "build_volume": [
      [
        0.0,
        223.0
      ],
      [
        0.0,
        220.0
      ],
      [
        0.0,
        205.0
      ]
    ],
    "feedrate_range": [
      3600.0,
      7200.0
    ]
  },
  "material": {
    "filament_diameter": 2.85,
    "min_nozzle_temperature_c": 190.0
  },
  "process": {
    "line_width": 0.4,
    "layer_height": 0.2,
    "monotonic_z": false
  },
  "start_gcode": "",
  "end_gcode": ""
}