{
  "version": 1,
  "name": "cura-Trimaker Cosmos II",
  "firmware": {
    "flavor": "marlin"
  },
  "machine": {
    "build_volume": [
      [
        0.0,
        200.0
      ],
      [
        0.0,
        200.0
      ],
      [
        0.0,
        200.0
      ]
    ],
    "feedrate_range": [
      2700.0,
      6000.0
    ]
  },
  "material": {
    "filament_diameter": 1.75,
    "min_nozzle_temperature_c": 190.0
  },
  "process": {
    "line_width": 0.4,
    "layer_height": 0.2,
    "monotonic_z": false
  },
  "start_gcode": ";Start GCode - Cosmos II - 3.x.x_SEGcTK_1.1\n M104 S120; Comienzo a calentar extrusor\n G21; Unidades en mm\n G90; absolute positioning\n M82; set extruder to absolute mode\n M107; Apagar FAN\n G28; Home\n M190 S60\n G29; Senso la cama\n M500\n G1 F5000 X0.5 Y0.5\n M109 S200\n M900 K0.04\n G1 F200 Z10\n G92 E0; Defino cero en la posici\u00f3n del actual del extrusor\n G1 F200 X0.5 Y0.5 Z0.300; Posiciono antes de hacer una l\u00ednea\n G1 F900 X0.5 Y51.5 E2.56436; Hago una l\u00ednea\n ",
  "end_gcode": ";CODIGO FINAL\n M107; Fan off\n G90; Set to absolute positioning\n G1 X0 Y0 Z201; Get extruder out of way\n G92 E0; Reset extruder position\n G1 E-1; Reduce filament pressure\n G92 E0; Reset extruder position again\n M140 S0; Disable heated bed\n M104 S0; Disable extruder\n M84; Turn steppers off"
}