{
  "version": 1,
  "name": "cura-Sovol SV01PRO",
  "firmware": {
    "flavor": "marlin"
  },
  "machine": {
    "build_volume": [
      [
        0.0,
        280.0
      ],
      [
        0.0,
        240.0
      ],
      [
        0.0,
        300.0
      ]
    ],
    "feedrate_range": [
      3000.0,
      7200.0
    ]
  },
  "material": {
    "filament_diameter": 1.75,
    "min_nozzle_temperature_c": 190.0
  },
  "process": {
    "line_width": 0.4,
    "layer_height": 0.2,
    "monotonic_z": false
  },
  "start_gcode": "M201 X500.00 Y500.00 Z100.00 E5000.00 ;Setup machine max acceleration\nM203 X500.00 Y500.00 Z10.00 E50.00 ;Setup machine max feedrate\nM204 P500.00 R1000.00 T500.00 ;Setup Print/Retract/Travel acceleration\nM205 X8.00 Y8.00 Z0.40 E5.00 ;Setup Jerk\nM220 S100 ;Reset Feedrate\nM221 S100 ;Reset Flowrate\n\nG28 ;Home\nM420 S1 ;use bed mesh, must have used G29 previously\n\nG92 E0 ;Reset Extruder\nG1 Z2.0 F3000 ;Move Z Axis up\nG1 X10.1 Y20 Z0.28 F5000.0 ;Move to start position\nG1 X10.1 Y200.0 Z0.28 F1500.0 E15 ;Draw the first line\nG1 X10.4 Y200.0 Z0.28 F5000.0 ;Move to side a little\nG1 X10.4 Y20 Z0.28 F1500.0 E30 ;Draw the second line\nG92 E0 ;Reset Extruder\nG1 Z2.0 F3000 ;Move Z Axis up\n",
  "end_gcode": "G91 ;Relative positioning\nG1 E-2 F2700 ;Retract a bit\nG1 E-2 Z0.2 F2400 ;Retract and raise Z\nG1 X0 Y240 F3000 ;Wipe out\nG1 Z10 ;Raise Z more\nG90 ;Absolute positioning\n\nG1 X0 Y240 ;Present print\nM106 S0 ;Turn-off fan\nM104 S0 ;Turn-off hotend\nM140 S0 ;Turn-off bed\n\nM84 X Y E ;Disable all steppers but Z\n"
}